batmanvssuperman finally watching ,0
batmanvssuperman opening executed hanszimmermusic providing score perfectly sets mood ,0
batmanvssuperman time skeptical fuck ,1
"epic fan 	article batmanvssuperman batman dccomics ,0"
watched batmanvssuperman film big stars rate stars long irritating ,1
finally watching batmanvssuperman hot men fighting lotgt ,0
shrmcubed batmanvssuperman reviews pretty harsh bad ,1
starmovies lol fits bender ruined batmanvssuperman ,1
watched batmanvssuperman batmanvsuperman wonderwoman galgadot awesome girlpower ,0
"batmanvssuperman captainamericacivilwar life imitates 	article aint pretty coincidence ,0"
wellllll dccomics batmanvssuperman ,0
batmanvssuperman awesome ,0
fine guys thehannah smh nah fine guys dey watchucheisclown louis fine batmanvssuperman ,1
 daryl dixon nasty wound walking dead photo tha batmanvssuperman ,1
movie epic batmanvssuperman actionmovies familytime ,0
currently watching dvd batmanvssuperman wow amazing incredible ,0
effort batmanvssuperman great benaffleck batman ,0
excl preview rainbow dash bad day pony batmanvssuperman ,1
batmanvssuperman incredible ,0
krypton people batmanvssuperman pure shit movie amazing benaffleck zacksnyder ,0
fangirlbring watching batmanvssuperman will happen will ,0